{
  "$schema": "https://json-schema.org/draft/2020-12/schema",
  "$id": "https://github.com/simai/ui-effects/blob/main/catalogue/policy.schema.json",
  "title": "simai/ui-effects theme policy sidecar",
  "description": "effects/policy.json: the catalogue order, Russian descriptions and roles, and tags. Schemes, pair and capabilities are in the manifests (simai.effect 1.1).",
  "type": "object",
  "additionalProperties": false,
  "required": ["schema", "version", "effects"],
  "properties": {
    "$schema": {"type": "string"},
    "schema": {"const": "simai.ui-effects.policy"},
    "version": {"const": 2},
    "note": {"type": "string"},
    "effects": {
      "type": "array",
      "items": {
        "type": "object",
        "additionalProperties": false,
        "required": ["id", "description", "role", "tags"],
        "properties": {
          "id": {"type": "string", "pattern": "^[a-z][a-z0-9-]{1,40}$"},
          "description": {"type": "object", "required": ["ru"], "additionalProperties": {"type": "string", "minLength": 1}},
          "role": {"type": "object", "required": ["ru"], "additionalProperties": {"type": "string", "minLength": 1}},
          "tags": {"type": "array", "uniqueItems": true, "items": {"type": "string", "pattern": "^[a-z][a-z-]*$"}}
        }
      }
    }
  }
}
