{
  "$schema": "../catalogue/policy.schema.json",
  "schema": "simai.ui-effects.policy",
  "version": 2,
  "note": "Catalogue sidecar: the order here is the catalogue order, with each effect's Russian description and role and its tags. Schemes, pair and capabilities are in each manifest (simai.effect 1.1).",
  "effects": [
    {
      "id": "aurora-curtain",
      "description": {
        "ru": "Светящиеся занавеси полярного сияния медленно складываются над тёмным звёздным небом."
      },
      "role": {
        "ru": "Ночное небо со светящимися занавесями. Свечению нужна тьма, поэтому схема одна — тёмная."
      },
      "tags": [
        "glow",
        "sky"
      ]
    },
    {
      "id": "star-flight",
      "description": {
        "ru": "Медленный полёт сквозь звёзды и туманности."
      },
      "role": {
        "ru": "Глубокий космос: звёзды пролетают мимо, газ туманностей светится. Только тёмная схема."
      },
      "tags": [
        "glow",
        "sky",
        "depth"
      ]
    },
    {
      "id": "text-flow",
      "description": {
        "ru": "Строки кода бегут в темноте, их подсвечивают медленные складки света."
      },
      "role": {
        "ru": "Код в темноте для продуктов для разработчиков. Только тёмная схема."
      },
      "tags": [
        "type",
        "flow"
      ]
    },
    {
      "id": "constellation-net",
      "description": {
        "ru": "Звёзды в трёх слоях глубины дрейфуют и связываются тонкими линиями, как живая сеть."
      },
      "role": {
        "ru": "Ночное звёздное небо с созвездиями. Только тёмная схема: светлое звёздное небо выглядит ошибкой."
      },
      "tags": [
        "particles",
        "lines",
        "sky"
      ]
    },
    {
      "id": "hex-conduits",
      "description": {
        "ru": "По рёбрам тёмной шестиугольной решётки бегут световые импульсы и оставляют гаснущий след."
      },
      "role": {
        "ru": "Решётка с бегущими импульсами: на тёмном — световоды, на светлом — чертёж схемы."
      },
      "tags": [
        "geometry",
        "lines"
      ]
    },
    {
      "id": "comet-flow",
      "description": {
        "ru": "Светящиеся частицы текут по невидимому полю течения и оставляют мягкие хвосты."
      },
      "role": {
        "ru": "Поток светящихся частиц на тёмном."
      },
      "tags": [
        "particles",
        "flow"
      ]
    },
    {
      "id": "nebula-mesh",
      "description": {
        "ru": "Крупные цветовые пятна темы медленно перетекают на почти чёрном фоне с тонким зерном."
      },
      "role": {
        "ru": "Глубокий меш-градиент на тёмном."
      },
      "tags": [
        "gradient"
      ]
    },
    {
      "id": "neon-horizon",
      "description": {
        "ru": "Перспективная неоновая сетка уходит к светящемуся горизонту под редкими звёздами."
      },
      "role": {
        "ru": "Неоновый горизонт и сетка, уходящая в глубину."
      },
      "tags": [
        "geometry",
        "depth"
      ]
    },
    {
      "id": "abyss-caustics",
      "description": {
        "ru": "Сетка подводных бликов колышется в глубокой воде, сверху падают мягкие лучи."
      },
      "role": {
        "ru": "Блики света в глубокой воде."
      },
      "tags": [
        "water",
        "glow"
      ]
    },
    {
      "id": "glyph-tide",
      "description": {
        "ru": "Поле моноширинных знаков, по которому медленно проходит волна света."
      },
      "role": {
        "ru": "Поле знаков с волной: на тёмном знаки загораются, на светлом — пропечатываются."
      },
      "tags": [
        "type"
      ]
    },
    {
      "id": "rain-glass",
      "description": {
        "ru": "Капли на ночном стекле, за ним размытые огни города; крупные капли сползают и оставляют дорожку."
      },
      "role": {
        "ru": "Ночное окно под дождём."
      },
      "tags": [
        "water",
        "depth"
      ]
    },
    {
      "id": "mist-gradient",
      "description": {
        "ru": "Меш-градиент из пяти мягких цветовых пятен темы, медленно дрейфующих по кривым Лиссажу; тонкое зерно против полос."
      },
      "role": {
        "ru": "Мягкий светлый меш-градиент."
      },
      "tags": [
        "gradient"
      ]
    },
    {
      "id": "daylight-caustics",
      "description": {
        "ru": "Сетка солнечных бликов, как свет сквозь воду на светлом дне; мягкий «шейдер» на 2D canvas."
      },
      "role": {
        "ru": "Солнечные блики на дне."
      },
      "tags": [
        "water"
      ]
    },
    {
      "id": "leaf-shadows",
      "description": {
        "ru": "Размытые тени веток на освещённой стене качаются от ветра; утро, полдень или вечер."
      },
      "role": {
        "ru": "Тени листвы на освещённой стене."
      },
      "tags": [
        "nature"
      ]
    },
    {
      "id": "paper-facets",
      "description": {
        "ru": "Смятый лист из треугольных граней; свет медленно обходит его, и складки то ловят, то теряют свет."
      },
      "role": {
        "ru": "Смятая бумага, свет обходит грани."
      },
      "tags": [
        "paper",
        "geometry"
      ]
    },
    {
      "id": "contour-map",
      "description": {
        "ru": "Изолинии медленно меняющегося рельефа, каждая пятая — утолщённая, как на топографической карте."
      },
      "role": {
        "ru": "Изолинии: на светлом — топографический лист, на тёмном — ночная карта."
      },
      "tags": [
        "lines"
      ]
    },
    {
      "id": "halftone-tide",
      "description": {
        "ru": "Полиграфический растр под 15°: точки растут и сжимаются под медленными встречными волнами."
      },
      "role": {
        "ru": "Растр с волнами: на светлом — газетная печать, на тёмном — люминофорный экран."
      },
      "tags": [
        "print"
      ]
    },
    {
      "id": "paper-hills",
      "description": {
        "ru": "Слои бумажных холмов в воздушной перспективе: дальние светлее и медленнее, в долинах туман."
      },
      "role": {
        "ru": "Бумажные холмы в дымке."
      },
      "tags": [
        "paper",
        "depth"
      ]
    }
  ]
}
